{
  "entity_type": "tool",
  "schema_version": "1.0",
  "tool_id": "TOOL-CAN-008",
  "tool_name": "Grammarly Business",
  "provider": "Grammarly, Inc.",
  "official_url": "https://www.grammarly.com/business",
  "classification": {
    "primary_capability": "CAP-CRT-03",
    "secondary_capabilities": [
      "CAP-CRT-02"
    ],
    "target_users": [
      "Local Business Owners",
      "Content Strategists",
      "Practitioners"
    ],
    "target_verticals": [
      "Healthcare",
      "Professional Services",
      "Local Retail"
    ]
  },
  "problem": {
    "primary_problem": "Execution of Fact Verification & Editing within local business content workflows.",
    "secondary_problems": [
      "Content production bottleneck",
      "Factual quality control"
    ],
    "use_cases": [
      "Automating or assisting Fact Verification & Editing for local service providers."
    ]
  },
  "workflow": {
    "supported_workflows": [
      "WF-AICONTENT-001"
    ],
    "workflow_stages": [
      "Research",
      "Brief",
      "Create",
      "Repurpose",
      "Maintain"
    ],
    "required_capabilities": [
      "CAP-CRT-03"
    ]
  },
  "commercial": {
    "pricing_model": "SUBSCRIPTION",
    "free_plan": false,
    "affiliate_available": false
  },
  "lifecycle_status": "LISTED",
  "governance": {
    "last_reviewed": "2026-09-26",
    "reviewer": "LOCATRIA Empirical Evaluation Lab",
    "review_status": "LISTED",
    "change_notes": "Sprint A.3.5: Updated lifecycle status to LISTED based on empirical evaluation and contextual recommendation decision framework."
  }
}
