{
  "entity_type": "tool",
  "schema_version": "1.0",
  "tool_id": "TOOL-CAN-005",
  "tool_name": "Hemingway Editor",
  "provider": "Hemingway Ltd.",
  "official_url": "https://hemingwayapp.com/",
  "classification": {
    "primary_capability": "CAP-CRT-02",
    "secondary_capabilities": [
      "CAP-CRT-03"
    ],
    "target_users": [
      "Local Business Owners",
      "Content Strategists",
      "Practitioners"
    ],
    "target_verticals": [
      "Healthcare",
      "Professional Services",
      "Local Retail"
    ]
  },
  "problem": {
    "primary_problem": "Execution of Local Tone & Voice Calibration within local business content workflows.",
    "secondary_problems": [
      "Content production bottleneck",
      "Factual quality control"
    ],
    "use_cases": [
      "Automating or assisting Local Tone & Voice Calibration for local service providers."
    ]
  },
  "workflow": {
    "supported_workflows": [
      "WF-AICONTENT-001"
    ],
    "workflow_stages": [
      "Research",
      "Brief",
      "Create",
      "Repurpose",
      "Maintain"
    ],
    "required_capabilities": [
      "CAP-CRT-02"
    ]
  },
  "commercial": {
    "pricing_model": "FREEMIUM",
    "free_plan": true,
    "affiliate_available": false
  },
  "lifecycle_status": "EVALUATED",
  "governance": {
    "last_reviewed": "2026-09-26",
    "reviewer": "LOCATRIA Empirical Evaluation Lab",
    "review_status": "EVALUATED",
    "change_notes": "Completed Sprint A.3.4 empirical evaluation."
  }
}
